

54,IT-MBo,Monte Bondone,11.04583,46.01468,GRA,reference,,"Marcolla, B., Cescatti, A., Manca, G., Zorer, R., Cavagna, M., Fiora, A., Gianelle, D., Rodeghiero, M., Sottocornola, M. and Zampedri, R.: Climatic controls and ecosystem responses drive the inter-annual variability of the net ecosystem exchange of an alpine meadow, Agric. For. Meteorol., 151(9), 1233–1243, 2011."

55,IT-PT1,Parco Ticino forest,9.06104,45.20087,DBF,reference,,"Migliavacca, M., Meroni, M., Busetto, L., Colombo, R., Zenone, T., Matteucci, G., Manca, G. and Seufert, G.: Modeling Gross Primary Production of Agro-Forestry Ecosystems by Assimilation of Satellite-Derived Information in a Process-Based Model, Sensors , 9(2), 922–942, 2009."

56,IT-Ren,Renon,11.43369,46.58686,ENF,,,
57,IT-Ro1,Roccarespampani 1,11.93001,42.40812,DBF,reference,,"Rey, A., Pegoraro, E., Tedeschi, V., De Parri, I., Jarvis, P. G. and Valentini, R.: Annual variation in soil respiration and its components in a coppice oak forest in Central Italy, Glob. Chang. Biol., 8(9), 851–866, 2002."
58,IT-Ro2,Roccarespampani 2,11.92093,42.39026,DBF,reference,,"Tedeschi, V., Rey, A., Manca, G., Valentini, R., Jarvis, P. G. and Borghetti, M.: Soil respiration in a Mediterranean oak forest at different developmental stages after coppicing, Glob. Chang. Biol., 12(1), 110–121, 2006."
59,IT-SR2,San Rossore 2,10.29095,43.73203,ENF,,,
60,IT-SRo,San Rossore,10.28444,43.72786,ENF,reference,,"Chiesi, M., Maselli, F., Bindi, M., Fibbi, L., Cherubini, P., Arlotta, E., Tirone, G., Matteucci, G. and Seufert, G.: Modelling carbon budget of Mediterranean forests using ground and remote sensing measurements, Agric. For. Meteorol., 135(1–4), 22–34, 2005."
61,IT-Tor,Torgnon,7.57806,45.84444,GRA,primary,doi:10.1088/1748-9326/8/2/025008,"Phenology and carbon dioxide source/sink strength of a subalpine grassland in response to an exceptionally short snow season. M. Galvagno, G. Wohlfahrt, E. Cremonese, M. Rossini, R. Colombo, G. Filippa, T. Julitta, G. Manca, C. Siniscalco, U. Morra di Cella and M. Migliavacca. Environmental Research Letters, 2013"
62,JP-MBF,Moshiri Birch Forest Site,142.3186,44.3869,DBF,reference,,"Matsumoto, K., Ohta, T., Nakai, T., Kuwada, T., Daikoku, K., Iida, S., Yabuki, H., Kononov, A. V., van der Molen, M. K., Kodama, Y., Maximov, T. C., Dolman, A. J. and Hattori, S.: Energy consumption and evapotranspiration at several boreal and temperate forests in the Far East, Agric. For. Meteorol., 148(12), 1978–1989, 2008."
63,JP-SMF,Seto Mixed Forest Site,137.0788,35.2617,MF,reference,,"Matsumoto, K., Ohta, T., Nakai, T., Kuwada, T., Daikoku, K., Iida, S., Yabuki, H., Kononov, A. V., van der Molen, M. K., Kodama, Y., Maximov, T. C., Dolman, A. J. and Hattori, S.: Energy consumption and evapotranspiration at several boreal and temperate forests in the Far East, Agric. For. Meteorol., 148(12), 1978–1989, 2008."
64,NL-Hor,Horstermeer,5.0713,52.24035,GRA,reference,,"Jacobs, C. M. J., Jacobs, A. F. G., Bosveld, F. C., Hendriks, D. M. D., Hensen, A., Kroon, P. S., Moors, E. J., Nol, L., Schrier-Uijl, A. and Veenendaal, E. M.: Variability of annual CO2 exchange from Dutch grasslands, Biogeosciences, 4(5), 803–816, 2007."
65,NL-Loo,Loobos,5.74356,52.16658,ENF,reference,,"Moors, E. J.: Water Use of Forests in The Netherlands, PhD-thesis, Vrije Universiteit Amsterdam., the Netherlands, 2012."
66,RU-Fyo,Fyodorovskoye,32.92208,56.46153,ENF,reference,,"Kurbatova, J., Li, C., Varlagin, A., Xiao, X. and Vygodskaya, N.: Modeling carbon dynamics in two adjacent spruce forests with different soil conditions in Russia, Biogeosciences, 5(4), 969–980, 2008."
67,SD-Dem,Demokeya,30.4783,13.2829,SAV,reference,,"Ardö, J., Mölder, M., El-Tahir, B. A. and Elkhidir, H. A. M.: Seasonal variation of carbon fluxes in a sparse savanna in semi arid Sudan, Carbon Balance Manag., 3, 7, 2008."
68,SN-Dhr,Dahra,-15.43222,15.40278,SAV,reference,,"Tagesson, T., Fensholt, R., Guiro, I., Rasmussen, M. O., Huber, S., Mbow, C., Garcia, M., Horion, S., Sandholt, I., Holm-Rasmussen, B., Göttsche, F. M., Ridler, M.-E., Olén, N., Lundegard Olsen, J., Ehammer, A., Madsen, M., Olesen, F. S. and Ardö, J.: Ecosystem properties of semiarid savanna grassland in West Africa and its relationship with environmental variability, Glob. Chang. Biol., 21(1), 250–264, 2015."
69,US-AR1,ARM USDA UNL OSU Woodward Switchgrass 1,-99.4200,36.4267,GRA,reference,,"Baldocchi, D., Penuelas, J. (2018) The Physics And Ecology Of Mining Carbon Dioxide From The Atmosphere By Ecosystems, Global Change Biology, (), "
70,US-AR2,ARM USDA UNL OSU Woodward Switchgrass 2,-99.5975,36.6358,GRA,reference,,"Baldocchi, D., Penuelas, J. (2018) The Physics And Ecology Of Mining Carbon Dioxide From The Atmosphere By Ecosystems, Global Change Biology, (), "
71,US-ARb,ARM Southern Great Plains burn site- Lamont,-98.0402,35.5497,GRA,reference,,"Fischer, M. L., Torn, M. S., Billesbach, D. P., Doyle, G., Northup, B., Biraud, S. C. (2012) Carbon, Water, And Heat Flux Responses To Experimental Burning And Drought In A Tallgrass Prairie, Agricultural And Forest Meteorology, 166-167(), 169-174"
72,US-ARc,ARM Southern Great Plains control site- Lamont,-98.0400,35.54649,GRA,reference,,"Baldocchi, D., Penuelas, J. (2018) The Physics And Ecology Of Mining Carbon Dioxide From The Atmosphere By Ecosystems, Global Change Biology, (), "
73,US-GBT,GLEES Brooklyn Tower,-106.2397,41.36579,ENF,reference,,"Baldocchi, D., Penuelas, J. (2018) The Physics And Ecology Of Mining Carbon Dioxide From The Atmosphere By Ecosystems, Global Change Biology, 45(2), 9275–9287"
74,US-GLE,GLEES,-106.2399,41.36653,ENF,reference,,"Arain, M. A., Restrepo-Coupe, N. (2005) Net Ecosystem Production In A Temperate Pine Plantation In Southeastern Canada, Agricultural And Forest Meteorology, 128(3-4), 223-241"
75,US-Ha1,Harvard Forest EMS Tower (HFR1),-72.1715,42.5378,DBF,reference,,"Antonarakis, A. S., Siqueira, P., Munger, J. W. (2017) Using Multi-Source Data From Lidar, Radar, Imaging Spectroscopy, And National Forest Inventories To Simulate Forest Carbon Fluxes, International Journal Of Remote Sensing, 38(19), 5464-5486"
76,US-KS2,Kennedy Space Center (scrub oak),-80.6715,28.6086,CSH,reference,,"Baldocchi, D., Penuelas, J. (2018) The Physics And Ecology Of Mining Carbon Dioxide From The Atmosphere By Ecosystems, Global Change Biology, 207(1), 117-126"
77,US-Los,Lost Creek,-89.9792,46.0827,WET,reference,,"Baker, I., Denning, A. S., Hanan, N., Prihodko, L., Uliasz, M., Vidale, P., Davis, K., Bakwin, P. (2003) Simulated And Observed Fluxes Of Sensible And Latent Heat And CO2 At The WLEF-TV Tower Using SiB2.5, Global Change Biology, 9(9), 1262-1277"
78,US-MMS,Morgan Monroe State Forest,-86.4131,39.3232,DBF,reference,,"Baldocchi, D. D., Black, T. A., Curtis, P. S., Falge, E., Fuentes, J. D., Granier, A., Gu, L., Knohl, A., Lee, X., Pilegaard, K., Schmid, H. P., Valentini, R., Wilson, K., Wofsy, S., Xu, L., Yamamoto, S. (2005) Predicting The Onset Of Net Carbon Uptake By Deciduous Forests With Soil Temperature And Climate Data: A Synthesis Of FLUXNET Data, International Journal Of Biometeorology, 49(6), 377-387"
79,US-Me2,Metolius mature ponderosa pine,-121.5574,44.4523,ENF,reference,,"Campbell, J. L., Sun, O. J., Law, B. E. (2004) Disturbance And Net Ecosystem Production Across Three Climatically Distinct Forest Landscapes, Global Biogeochemical Cycles, 18(4), n/a-n/a"
80,US-Myb,Mayberry Wetland,-121.76498,38.049861,WET,reference,,"Baldocchi, D., Penuelas, J. (2018) The Physics And Ecology Of Mining Carbon Dioxide From The Atmosphere By Ecosystems, Global Change Biology, 256-257(7), 179-195"
81,US-NR1,Niwot Ridge Forest (LTER NWT1),-105.5464,40.0329,ENF,reference,,"Albert, L. P., Keenan, T. F., Burns, S. P., Huxman, T. E., Monson, R. K. (2017) Climate Controls Over Ecosystem Metabolism: Insights From A Fifteen-Year Inductive Artificial Neural Network Synthesis For A Subalpine Forest, Oecologia, 184(1), 25-41"
82,US-Ne1,Mead - irrigated continuous maize site,-96.4766400,41.1650600,CRO,reference,,"Amos, B., Arkebauer, T. J., Doran, J. W. (2005) Soil Surface Fluxes Of Greenhouse Gases In An Irrigated Maize-Based Agroecosystem, Soil Science Society Of America Journal, 69(2), 387-395"
83,US-Ne2,Mead - irrigated maize-soybean rotation site,-96.4701,41.1648700,CRO,reference,,"Amos, B., Arkebauer, T. J., Doran, J. W. (2005) Soil Surface Fluxes Of Greenhouse Gases In An Irrigated Maize-Based Agroecosystem, Soil Science Society Of America Journal, 69(2), 387-395"
84,US-Ne3,Mead - rainfed maize-soybean rotation site,-96.4396500,41.1796700,CRO,reference,,"Amos, B., Arkebauer, T. J., Doran, J. W. (2005) Soil Surface Fluxes Of Greenhouse Gases In An Irrigated Maize-Based Agroecosystem, Soil Science Society Of America Journal, 69(2), 387-395"
85,US-ORv,Olentangy River Wetland Research Park,-83.0183,40.0201,WET,reference,,"Brooker, M. R., Bohrer, G., Mouser, P. J. (2014) Variations In Potential Ch4 Flux And Co2 Respiration From Freshwater Wetland Sediments That Differ By Microsite Location, Depth And Temperature, Ecological Engineering, 72(8), 84-94"
86,US-PFa,Park Falls/WLEF,-90.2723,45.9459,MF,reference,," (2012) The Imprint Of Surface Fluxes And Transport On Variations In Total Column Carbon Dioxide, Biogeosciences, 9(3), 875-891"
87,US-Prr,Poker Flat Research Range Black Spruce Forest,-147.48756,65.12367,ENF,reference,," (2015) Understory CO2, Sensible Heat, and Latent Heat Fluxes in a Black Spruce Forest in Interior Alaska, Agricultural And Forest Meteorology, 214-215(2), 80-90"
88,US-Syv,Sylvania Wilderness Area,-89.3477,46.2420,MF,reference,,"Barr, A., Richardson, A., Hollinger, D., Papale, D., Arain, M., Black, T., Bohrer, G., Dragoni, D., Fischer, M., Gu, L., Law, B., Margolis, H., McCaughey, J., Munger, J., Oechel, W., Schaeffer, K. (2013) Use Of Change-Point Detection For Friction–Velocity Threshold Evaluation In Eddy-Covariance Studies, Agricultural And Forest Meteorology, 171-172(7), 31-45"
89,US-Ton,Tonzi Ranch,-120.96598,38.4316,WSA,reference,,"Baldocchi, D. D., Ma, S., Rambal, S., Misson, L., Ourcival, J., Limousin, J., Pereira, J., Papale, D. (2010) On The Differential Advantages Of Evergreenness And Deciduousness In Mediterranean Oak Woodlands: A Flux Perspective, Ecological Applications, 20(6), 1583-1597"
90,US-Tw4,Twitchell East End Wetland,-121.6414,38.10298,Wet,reference,,"Chamberlain, S. D., Verfaillie, J., Eichelmann, E., Hemes, K. S., Baldocchi, D. D. (2017) Evaluation Of Density Corrections To Methane Fluxes Measured By Open-Path Eddy Covariance Over Contrasting Landscapes, Boundary-Layer Meteorology, 122(1), 145-167"
91,US-Twt,Twitchell Island,-121.65310,38.1087204,CRO,reference,,"Baldocchi, D., Penuelas, J. (2018) The Physics And Ecology Of Mining Carbon Dioxide From The Atmosphere By Ecosystems, Global Change Biology, 45(6), 9275–9287"
92,US-UMB,Univ. of Mich. Biological Station,-84.7138,45.5598,DBF,reference,,"Aron, P. G., Poulsen, C. J., Fiorella, R. P., Matheny, A. M. (2019) Stable Water Isotopes Reveal Effects Of Intermediate Disturbance And Canopy Structure On Forest Water Cycling, Journal Of Geophysical Research: Biogeosciences, 124(10), 2958-2975"
93,US-UMd,UMBS Disturbance,-84.6975,45.5625,DBF,reference,,"Atkins, J. W., Bohrer, G., Fahey, R. T., Hardiman, B. S., Morin, T. H., Stovall, A. E., Zimmerman, N., Gough, C. M. (2018) Quantifying Vegetation And Canopy Structural Complexity From Terrestrial Lidar Data Using The Forestr R Package, Methods In Ecology And Evolution, 9(10), 2057-2066"
94,US-Var,Vaira Ranch- Ione,-120.9507,38.4133,GRA,reference,,"Baldocchi, D. D., Xu, L., Kiang, N. (2004) How Plant Functional-Type, Weather, Seasonal Drought, And Soil Physical Properties Alter Water And Energy Fluxes Of An Oak–Grass Savanna And An Annual Grassland, Agricultural And Forest Meteorology, 123(1-2), 13-39"
95,US-WCr,Willow Creek,-90.0799,45.8059,DBF,reference,,"Baker, I., Denning, A. S., Hanan, N., Prihodko, L., Uliasz, M., Vidale, P., Davis, K., Bakwin, P. (2003) Simulated And Observed Fluxes Of Sensible And Latent Heat And CO2 At The WLEF-TV Tower Using SiB2.5, Global Change Biology, 9(9), 1262-1277"
